{
  "schema": "factory/run@1",
  "id": "R-000013",
  "rev": 4,
  "created_at": "2026-10-12T04:20:00.000Z",
  "updated_at": "2026-10-12T04:29:00.000Z",
  "task_id": "T-0011",
  "goal_id": "G-001",
  "epic_id": "E-0001",
  "kind": "author",
  "role": "tech-writer",
  "subagent_type": "software-factory:tech-writer",
  "model": "sonnet",
  "status": "completed",
  "session_id": "sess-cto-1",
  "agent_id": "a000013f00d",
  "tool_use_id": "toolu_000013",
  "dispatched_at": "2026-10-12T04:20:00.000Z",
  "started_at": "2026-10-12T04:20:20.000Z",
  "ended_at": "2026-10-12T04:29:00.000Z",
  "isolation": "worktree",
  "worktree_path": null,
  "branch": "factory/T-0011-docs-vin-decode-api",
  "head_sha": "fffffff00013",
  "brief_path": "runs/R-000013/brief.md",
  "handoff_path": "runs/R-000013/handoff.json",
  "estimate_tokens": 200000,
  "round": 1,
  "review_role": null,
  "exit": null
}
