{
  "schema": "factory/run@1",
  "id": "R-000020",
  "rev": 4,
  "created_at": "2026-10-12T09:40:00.000Z",
  "updated_at": "2026-10-12T09:55:00.000Z",
  "task_id": "T-0017",
  "goal_id": "G-001",
  "epic_id": "E-0002",
  "kind": "author",
  "role": "devops-release",
  "subagent_type": "software-factory:devops-release",
  "model": "sonnet",
  "status": "completed",
  "session_id": "sess-cto-1",
  "agent_id": "a000020f00d",
  "tool_use_id": "toolu_000020",
  "dispatched_at": "2026-10-12T09:40:00.000Z",
  "started_at": "2026-10-12T09:40:20.000Z",
  "ended_at": "2026-10-12T09:55:00.000Z",
  "isolation": "worktree",
  "worktree_path": null,
  "branch": "factory/T-0017-ci-job-for-decoder-tests",
  "head_sha": "fffffff00020",
  "brief_path": "runs/R-000020/brief.md",
  "handoff_path": "runs/R-000020/handoff.json",
  "estimate_tokens": 250000,
  "round": 1,
  "review_role": null,
  "exit": null
}
