{
  "schema": "factory/run@1",
  "id": "R-000032",
  "rev": 4,
  "created_at": "2026-10-12T10:50:00.000Z",
  "updated_at": "2026-10-12T11:07:00.000Z",
  "task_id": "T-0025",
  "goal_id": "G-002",
  "epic_id": null,
  "kind": "author",
  "role": "staff-engineer",
  "subagent_type": "software-factory:staff-engineer",
  "model": "opus",
  "status": "completed",
  "session_id": "sess-cto-1",
  "agent_id": "a000032f00d",
  "tool_use_id": "toolu_000032",
  "dispatched_at": "2026-10-12T10:50:00.000Z",
  "started_at": "2026-10-12T10:50:20.000Z",
  "ended_at": "2026-10-12T11:07:00.000Z",
  "isolation": "none",
  "worktree_path": null,
  "branch": null,
  "head_sha": "fffffff00032",
  "brief_path": "runs/R-000032/brief.md",
  "handoff_path": "runs/R-000032/handoff.json",
  "estimate_tokens": 500000,
  "round": 1,
  "review_role": null,
  "exit": null
}
