{
  "schema": "factory/run@1",
  "id": "R-000025",
  "rev": 4,
  "created_at": "2026-10-12T08:20:00.000Z",
  "updated_at": "2026-10-12T08:34:00.000Z",
  "task_id": "T-0021",
  "goal_id": "G-001",
  "epic_id": "E-0002",
  "kind": "author",
  "role": "backend-engineer",
  "subagent_type": "software-factory:backend-engineer",
  "model": "sonnet",
  "status": "failed",
  "session_id": "sess-cto-1",
  "agent_id": "a000025f00d",
  "tool_use_id": "toolu_000025",
  "dispatched_at": "2026-10-12T08:20:00.000Z",
  "started_at": "2026-10-12T08:20:20.000Z",
  "ended_at": "2026-10-12T08:34:00.000Z",
  "isolation": "worktree",
  "worktree_path": null,
  "branch": "factory/T-0021-retry-vendor-api-on-timeout",
  "head_sha": "fffffff00025",
  "brief_path": "runs/R-000025/brief.md",
  "handoff_path": "runs/R-000025/handoff.json",
  "estimate_tokens": 600000,
  "round": 3,
  "review_role": null,
  "exit": {
    "reason": "checks_failed",
    "message": "npm test failed 3 times"
  }
}
