{
  "schema": "factory/run@1",
  "id": "R-000010",
  "rev": 4,
  "created_at": "2026-10-11T18:20:00.000Z",
  "updated_at": "2026-10-11T18:53:00.000Z",
  "task_id": "T-0008",
  "goal_id": "G-001",
  "epic_id": "E-0001",
  "kind": "author",
  "role": "data-engineer",
  "subagent_type": "software-factory:data-engineer",
  "model": "sonnet",
  "status": "completed",
  "session_id": "sess-cto-1",
  "agent_id": "a000010f00d",
  "tool_use_id": "toolu_000010",
  "dispatched_at": "2026-10-11T18:20:00.000Z",
  "started_at": "2026-10-11T18:20:20.000Z",
  "ended_at": "2026-10-11T18:53:00.000Z",
  "isolation": "worktree",
  "worktree_path": null,
  "branch": "factory/T-0008-add-vin-decodes-cache-table-mi",
  "head_sha": "fffffff00010",
  "brief_path": "runs/R-000010/brief.md",
  "handoff_path": "runs/R-000010/handoff.json",
  "estimate_tokens": 250000,
  "round": 2,
  "review_role": null,
  "exit": null
}
