{
  "schema": "factory/run@1",
  "id": "R-000008",
  "rev": 4,
  "created_at": "2026-10-11T19:20:00.000Z",
  "updated_at": "2026-10-11T19:38:00.000Z",
  "task_id": "T-0007",
  "goal_id": "G-001",
  "epic_id": "E-0001",
  "kind": "author",
  "role": "backend-engineer",
  "subagent_type": "software-factory:backend-engineer",
  "model": "sonnet",
  "status": "completed",
  "session_id": "sess-cto-1",
  "agent_id": "a000008f00d",
  "tool_use_id": "toolu_000008",
  "dispatched_at": "2026-10-11T19:20:00.000Z",
  "started_at": "2026-10-11T19:20:20.000Z",
  "ended_at": "2026-10-11T19:38:00.000Z",
  "isolation": "worktree",
  "worktree_path": null,
  "branch": "factory/T-0007-add-vin-decode-service-with-ve",
  "head_sha": "fffffff00008",
  "brief_path": "runs/R-000008/brief.md",
  "handoff_path": "runs/R-000008/handoff.json",
  "estimate_tokens": 600000,
  "round": 2,
  "review_role": null,
  "exit": null
}
