{
  "schema": "factory/run@1",
  "id": "R-000011",
  "rev": 4,
  "created_at": "2026-10-11T22:20:00.000Z",
  "updated_at": "2026-10-11T22:51:00.000Z",
  "task_id": "T-0009",
  "goal_id": "G-001",
  "epic_id": "E-0001",
  "kind": "author",
  "role": "qa-engineer",
  "subagent_type": "software-factory:qa-engineer",
  "model": "sonnet",
  "status": "completed",
  "session_id": "sess-cto-1",
  "agent_id": "a000011f00d",
  "tool_use_id": "toolu_000011",
  "dispatched_at": "2026-10-11T22:20:00.000Z",
  "started_at": "2026-10-11T22:20:20.000Z",
  "ended_at": "2026-10-11T22:51:00.000Z",
  "isolation": "worktree",
  "worktree_path": null,
  "branch": null,
  "head_sha": "fffffff00011",
  "brief_path": "runs/R-000011/brief.md",
  "handoff_path": "runs/R-000011/handoff.json",
  "estimate_tokens": 300000,
  "round": 1,
  "review_role": null,
  "exit": null
}
