{
  "schema": "factory/run@1",
  "id": "R-000014",
  "rev": 4,
  "created_at": "2026-10-12T13:30:00.000Z",
  "updated_at": "2026-10-12T14:28:00.000Z",
  "task_id": "T-0012",
  "goal_id": "G-001",
  "epic_id": "E-0002",
  "kind": "author",
  "role": "frontend-engineer",
  "subagent_type": "software-factory:frontend-engineer",
  "model": "sonnet",
  "status": "running",
  "session_id": "sess-cto-1",
  "agent_id": "a000014f00d",
  "tool_use_id": "toolu_000014",
  "dispatched_at": "2026-10-12T13:30:00.000Z",
  "started_at": "2026-10-12T13:30:20.000Z",
  "ended_at": null,
  "isolation": "worktree",
  "worktree_path": null,
  "branch": "factory/T-0012-intake-form-vin-field-with-liv",
  "head_sha": "fffffff00014",
  "brief_path": "runs/R-000014/brief.md",
  "handoff_path": "runs/R-000014/handoff.json",
  "estimate_tokens": 600000,
  "round": 1,
  "review_role": null,
  "exit": null
}
