{
  "schema": "factory/run@1",
  "id": "R-000027",
  "rev": 4,
  "created_at": "2026-10-12T13:05:00.000Z",
  "updated_at": "2026-10-12T13:16:00.000Z",
  "task_id": "T-0026",
  "goal_id": "G-001",
  "epic_id": "E-0002",
  "kind": "author",
  "role": "frontend-engineer",
  "subagent_type": "software-factory:frontend-engineer",
  "model": "sonnet",
  "status": "deferred",
  "session_id": "sess-cto-1",
  "agent_id": "a000027f00d",
  "tool_use_id": "toolu_000027",
  "dispatched_at": "2026-10-12T13:05:00.000Z",
  "started_at": "2026-10-12T13:05:20.000Z",
  "ended_at": "2026-10-12T13:16:00.000Z",
  "isolation": "worktree",
  "worktree_path": null,
  "branch": "factory/T-0026-decode-history-side-panel",
  "head_sha": "fffffff00027",
  "brief_path": "runs/R-000027/brief.md",
  "handoff_path": "runs/R-000027/handoff.json",
  "estimate_tokens": 600000,
  "round": 1,
  "review_role": null,
  "exit": null
}
