{
  "schema": "factory/run@1",
  "id": "R-000016",
  "rev": 4,
  "created_at": "2026-10-12T13:10:00.000Z",
  "updated_at": "2026-10-12T14:28:00.000Z",
  "task_id": "T-0013",
  "goal_id": "G-001",
  "epic_id": "E-0002",
  "kind": "review",
  "role": "code-reviewer",
  "subagent_type": "software-factory:code-reviewer",
  "model": "sonnet",
  "status": "running",
  "session_id": "sess-cto-1",
  "agent_id": "a000016f00d",
  "tool_use_id": "toolu_000016",
  "dispatched_at": "2026-10-12T13:10:00.000Z",
  "started_at": "2026-10-12T13:10:20.000Z",
  "ended_at": null,
  "isolation": "worktree",
  "worktree_path": null,
  "branch": "factory/T-0013-decode-endpoint-response-cachi",
  "head_sha": "fffffff00016",
  "brief_path": "runs/R-000016/brief.md",
  "handoff_path": "runs/R-000016/handoff.json",
  "estimate_tokens": 600000,
  "round": 2,
  "review_role": "code-reviewer",
  "exit": null
}
